{"$schema":"https://json-schema.org/draft/2020-12/schema","$id":"https://schemas.rotprods.dev/clever/v1/trace.schema.json","type":"object","additionalProperties":false,"required":["contractVersion","traceId","spanId","correlationId","runtimeId","operation","startedAt","outcome"],"properties":{"contractVersion":{"$ref":"https://schemas.rotprods.dev/clever/v1/common.schema.json#/$defs/contractVersion"},"traceId":{"type":"string","minLength":1},"spanId":{"type":"string","minLength":1},"parentSpanId":{"type":"string"},"correlationId":{"type":"string","minLength":1},"runtimeId":{"type":"string","minLength":1},"capabilityId":{"type":"string"},"operation":{"type":"string","minLength":1},"startedAt":{"$ref":"https://schemas.rotprods.dev/clever/v1/common.schema.json#/$defs/timestamp"},"endedAt":{"$ref":"https://schemas.rotprods.dev/clever/v1/common.schema.json#/$defs/timestamp"},"metrics":{"type":"array","items":{"type":"object","additionalProperties":false,"required":["name","value","unit"],"properties":{"name":{"type":"string"},"value":{"type":"number"},"unit":{"type":"string"}}}},"evidence":{"type":"array","items":{"$ref":"https://schemas.rotprods.dev/clever/v1/common.schema.json#/$defs/evidenceRef"}},"outcome":{"type":"string","minLength":1},"promotionCandidateId":{"type":"string"}}}
