{"contractVersion":{"major":1,"minor":0},"traceId":"trace_demo","spanId":"span_demo","correlationId":"corr_demo","runtimeId":"openjarvis-cognition","capabilityId":"inference.generate","operation":"generate","startedAt":"2026-09-01T00:00:00Z","endedAt":"2026-09-01T00:00:01Z","metrics":[{"name":"latency","value":1.0,"unit":"s"}],"evidence":[{"evidenceId":"EVID-DEMO"}],"outcome":"SUCCESS"}
